{
  "region": "WA",
  "anchor": "Bayswater",
  "age": 27,
  "income": 95000,
  "finances": {
    "deposit": 55000,
    "cash_buffer": 8000,
    "credit_line": 0,
    "credit_rate_pct": 0,
    "currently_renting": true,
    "monthly_commitments": 600
  },
  "life_stage": "young_couple",
  "criteria": { "proximity": 5, "amenity": 4, "growth": 4, "land": 1, "schools": 1 },
  "filters": { "min_beds": 3 },
  "horizon_years": 1
}
